{
  "$schema": "https://json-schema.org/draft/2020-12/schema",
  "$id": "urn:sylvia:schema:sylviapack-manifest:v1",
  "title": ".sylviapack manifest",
  "description": "sylviapack/manifest.json, the first entry of a .sylviapack v1 wired-transfer bundle (plan 8.5, 16.4; ADR-0010). The container is a single-volume ZIP (ZIP64 when needed) laid out back to back with no archive comment: entry 1 is this manifest (stored), entry 2 is sylviapack/manifest.sha256 (stored, exactly 65 bytes: the lowercase hex SHA-256 of the manifest entry's bytes followed by a line feed), then one entry content/<path> per file in manifest order. Audio, EPUB, PDF and cover entries are stored (method 0); text and Markdown may be deflated (method 8). Entries are regular, non-executable files only. Rules the schema cannot express and readers must enforce: paths are Unicode NFC and unique after case folding and normalization, and no path is also a folder of another; total_size is the sum of size; group_id on a file names a group in groups; every audio member of an audiobook group has a unique order >= 1, and only audio and cover files belong to an audiobook group; order appears only with group_id; the per-kind size limits and the 10,000-entry limit (manifest entries included). The manifest never contains a credential, token or device identifier.",
  "type": "object",
  "required": ["schema_version", "format", "pack_id", "created_at", "generator", "files", "groups", "total_size"],
  "properties": {
    "schema_version": { "const": 1 },
    "format": { "const": "sylviapack" },
    "pack_id": { "type": "string", "format": "uuid" },
    "created_at": { "type": "string", "format": "date-time" },
    "generator": {
      "description": "The program that wrote the bundle (for diagnostics only).",
      "type": "object",
      "required": ["name", "version"],
      "properties": {
        "name": { "type": "string", "minLength": 1, "maxLength": 128 },
        "version": { "type": "string", "minLength": 1, "maxLength": 64 }
      }
    },
    "files": {
      "type": "array",
      "minItems": 1,
      "maxItems": 9998,
      "items": { "$ref": "#/$defs/file" }
    },
    "groups": {
      "type": "array",
      "items": { "$ref": "#/$defs/group" }
    },
    "total_size": {
      "description": "Sum of every file's size, in bytes.",
      "type": "integer",
      "minimum": 0
    }
  },
  "$defs": {
    "path": {
      "description": "Relative path under content/ in the archive: 1 to 15 components separated by '/', none empty, '.' or '..', no leading '/', no backslash, colon or control character; at most 512 UTF-8 bytes in total and 255 per component (readers check bytes). The archive entry name is content/ followed by this path, so it has at most 16 components and 520 bytes. The 512-byte bound keeps an extracted file's full path (a container directory of about 180 to 250 bytes plus this path) below PATH_MAX (1024 bytes).",
      "type": "string",
      "minLength": 1,
      "maxLength": 512,
      "pattern": "^(?:(?!\\.{1,2}/)[^/\\\\:\\u0000-\\u001F\\u007F]{1,255}/){0,14}(?!\\.{1,2}$)[^/\\\\:\\u0000-\\u001F\\u007F]{1,255}$"
    },
    "file": {
      "type": "object",
      "required": ["path", "size", "sha256", "media_type", "kind"],
      "properties": {
        "path": { "$ref": "#/$defs/path" },
        "size": {
          "description": "Uncompressed size in bytes; must equal the archive entry's sizes and the bytes produced.",
          "type": "integer",
          "minimum": 0
        },
        "sha256": { "type": "string", "pattern": "^[0-9a-f]{64}$" },
        "media_type": { "type": "string", "minLength": 1, "maxLength": 128 },
        "kind": { "enum": ["epub", "pdf", "text", "markdown", "audio", "cover"] },
        "group_id": { "$ref": "#/$defs/group_id" },
        "order": {
          "description": "1-based member order inside an audiobook group.",
          "type": "integer",
          "minimum": 1
        }
      }
    },
    "group_id": {
      "type": "string",
      "pattern": "^[A-Za-z0-9_-]{1,64}$"
    },
    "group": {
      "type": "object",
      "required": ["group_id", "kind"],
      "properties": {
        "group_id": { "$ref": "#/$defs/group_id" },
        "kind": {
          "description": "audiobook: one logical audiobook of ordered audio members (plan 8.3). publication: a single EPUB, PDF, text or Markdown work with optional cover.",
          "enum": ["audiobook", "publication"]
        },
        "title": { "type": "string", "maxLength": 1024 },
        "creators": { "type": "array", "items": { "type": "string", "maxLength": 512 } },
        "language": { "type": "string", "maxLength": 35 },
        "identifiers": {
          "type": "array",
          "items": {
            "type": "object",
            "required": ["scheme", "value"],
            "properties": {
              "scheme": { "type": "string", "minLength": 1, "maxLength": 64 },
              "value": { "type": "string", "minLength": 1, "maxLength": 512 }
            }
          }
        },
        "member_order_basis": {
          "description": "How the member order was decided: embedded disc/track tags, natural file-name order, or confirmed by the user (plan 8.3).",
          "enum": ["embedded_track", "filename", "user_confirmed"]
        }
      }
    }
  }
}
