{
  "created_at": "2026-10-06T02:30:00Z",
  "files": [
    {
      "group_id": "walden",
      "kind": "epub",
      "media_type": "application/epub+zip",
      "path": "Walden/se-walden.epub",
      "sha256": "6168a788b950aae3e778bfe9e176feda5d948453ca0050cf00ba9e706d7332ae",
      "size": 997147
    },
    {
      "group_id": "meditations-audio",
      "kind": "audio",
      "media_type": "audio/mpeg",
      "order": 1,
      "path": "Meditations (LibriVox)/01.mp3",
      "sha256": "6a3b752cc744ccb310a6d71149b96a7f29d632e35ca5a6ad8abb3e46c532a1ad",
      "size": 1441009
    },
    {
      "group_id": "meditations-audio",
      "kind": "audio",
      "media_type": "audio/mpeg",
      "order": 2,
      "path": "Meditations (LibriVox)/02.mp3",
      "sha256": "4e27b8d12646a2fc6c9e37bd31229405ea52a65a4904a069ce7aa5b005a163f3",
      "size": 1201100
    }
  ],
  "format": "sylviapack",
  "generator": {
    "name": "Sylvia for Mac",
    "version": "0.1"
  },
  "groups": [
    {
      "creators": [
        "Henry David Thoreau"
      ],
      "group_id": "walden",
      "identifiers": [
        {
          "scheme": "url",
          "value": "https://standardebooks.org/ebooks/henry-david-thoreau/walden"
        }
      ],
      "kind": "publication",
      "language": "en",
      "title": "Walden"
    },
    {
      "creators": [
        "Marcus Aurelius"
      ],
      "group_id": "meditations-audio",
      "kind": "audiobook",
      "member_order_basis": "user_confirmed",
      "title": "Meditations"
    }
  ],
  "pack_id": "7A1E2C3D-4B5F-4E6A-9C8B-1D2E3F4A5B6C",
  "schema_version": 1,
  "total_size": 3639256
}
