{
  "created_at": "2026-09-21T14:13:20Z",
  "files": [
    {
      "group_id": "generated-audiobook",
      "kind": "audio",
      "media_type": "audio/x-caf",
      "order": 1,
      "path": "Generated Audiobook/part-01.caf",
      "sha256": "b4e3eac6d299ef937eb52a103187a2847a63cc0084e9ab2d4c18d41bfa91bcc1",
      "size": 4831838986
    },
    {
      "group_id": "generated-audiobook",
      "kind": "audio",
      "media_type": "audio/x-caf",
      "order": 2,
      "path": "Generated Audiobook/part-02.caf",
      "sha256": "ac146be5ee4fe4187582a6335d436b04aacc52e1b4e0e603296dd5d50070e7ab",
      "size": 3000068
    },
    {
      "kind": "markdown",
      "media_type": "text/markdown",
      "path": "Generated Audiobook/notes.md",
      "sha256": "50c5de4981c1153ede3e7074ab4bf6ca4adc3532960c1d413dac8ce7950b3e6d",
      "size": 72
    },
    {
      "kind": "text",
      "media_type": "text/plain",
      "path": "Generated Text/chapter.txt",
      "sha256": "5da1084cb18247b7775ba562b3361a45a7f04a32f113908b9c2b6b38372d61af",
      "size": 728890
    },
    {
      "kind": "audio",
      "media_type": "audio/mpeg",
      "path": "LibriVox Meditations/meditations-01.mp3",
      "sha256": "dc3f1d4729eafb250e03ddee84e546a6f14debc31a4f4cbf205a022f32ed15be",
      "size": 10862777
    }
  ],
  "format": "sylviapack",
  "generator": {
    "name": "sylviapack-tool gen-pack",
    "version": "1"
  },
  "groups": [
    {
      "creators": [
        "Sylvia test generator"
      ],
      "group_id": "generated-audiobook",
      "kind": "audiobook",
      "language": "en",
      "member_order_basis": "filename",
      "title": "Generated Audiobook"
    }
  ],
  "pack_id": "5C1A0C2E-0003-4E5F-8A9B-000000000003",
  "schema_version": 1,
  "total_size": 4846430793
}
