{
  "created_at": "2026-10-06T02:30:00Z",
  "files": [
    {
      "kind": "epub",
      "media_type": "application/epub+zip",
      "path": "Walden/se-walden.epub",
      "sha256": "6168a788b950aae3e778bfe9e176feda5d948453ca0050cf00ba9e706d7332ae",
      "size": 997147
    }
  ],
  "format": "sylviapack",
  "generator": {
    "name": "Sylvia for Mac",
    "version": "0.1"
  },
  "groups": [],
  "pack_id": "7A1E2C3D-4B5F-4E6A-9C8B-1D2E3F4A5B6C",
  "schema_version": 1,
  "total_size": 997147
}
